110000008130000,FORTUL
110000008159100,PUERTO RONDON
110000008173600,SARAVENA
110000008179400,TAME
110000008500000,DEPARTAMENTO DE CASANARE
110000008500100,MUNICIPIO DE YOPAL
110000008501000,AGUAZUL
110000008501500,CHAMEZA
110000008512500,HATO COROZAL
110000008513600,LA SALINA
110000008513900,MANI
110000008516200,MONTERREY
110000008522500,NUNCHIA
110000008523000,OROCUE
110000008525000,PAZ DE ARIPORO
110000008526300,PORE
110000008527900,RECETOR
110000008530000,SABANALARGA CASANARE
110000008531500,SACAMA
110000008532500,SAN LUIS DE PALENQUE
110000008540000,TAMARA
110000008541000,TAURAMENA
110000008543000,TRINIDAD
110000008544000,VILLANUEVA CASANARE
110000008600000,DEPARTAMENTO DEL PUTUMAYO
110000008600100,MUNICIPIO DE MOCOA
110000008621900,COLON
110000008632000,ORITO
110000008656800,PUERTO ASIS
110000008656900,PUERTO CAICEDO
110000008657100,PUERTO GUZMAN
110000008657300,PUERTO LEGUIZAMO
110000008674900,SIBUNDOY
110000008675500,SAN FRANCISCO PUTUMAYO
110000008675700,SAN MIGUEL PUTUMAYO
110000008676000,SANTIAGO PUTUMAYO
110000008686500,VALLE DEL GUAMUEZ (LA HORMIGA)
110000008688500,VILLAGARZÓN (VILLA AMAZONICA)
110000008800000,DEPARTAMENTO DE SAN ANDRÉS Y PROVIDENCIA
110000008856400,MUNICIPIO DE PROVIDENCIA
110000009100000,DEPARTAMENTO DEL AMAZONAS
110000009100100,MUNICIPIO DE LETICIA
110000009154000,PUERTO NARIÑO
110000009400000,DEPARTAMENTO DEL GUAINÍA
110000009400100,MUNICIPIO DE PUERTO INIRIDA
110000009500000,DEPARTAMENTO DEL GUAVIARE
110000009500100,MUNICIPIO DE SAN JOSÉ DEL GUAVIARE
110000009501500,CALAMAR GUAVIARE
110000009502500,EL RETORNO
110000009520000,MIRAFLORES GUAVIARE
110000009700000,DEPARTAMENTO DEL VAUPÉS
110000009700100,MUNICIPIO DE MITÚ
110000009716100,CARURU
110000009766600,TARAIRA
110000009900000,DEPARTAMENTO DEL VICHADA
110000009900100,MUNICIPIO DE PUERTO CARREÑO
110000009952400,LA PRIMAVERA
110000009962400,SANTA ROSALIA
110000009977300,CUMARIBO
120000000500001,BENEFICENCIA DE ANTIOQUIA -BENEDAN- PROGRAMA DE LA LOTERÍA DE MEDELLÍN
120000000500002,DEPARTAMENTO ADMINISTRATIVO DE VALORIZACIÓN DEPARTAMENTAL ANTIOQUIA
120000000500003,DIRECCIÓN DEPARTAMENTAL DE TRÁNSITO DE ANTIOQUIA
120000000500004,E.S.P. EDATEL S. A.
120000000500005,FABRICA DE LICORES Y ALCOHOLES DE ANTIOQUIA
120000000500006,FONDO ROTATORIO DE TALLERES DEL DEPARTAMENTO - ANTIOQUIA
120000000500007,E.S.E. HOSPITAL MENTAL DE ANTIOQUIA -HOMO-
120000000500008,TECNOLÓGICO DE ANTIOQUIA
120000000500009,INSTITUTO PARA EL DESARROLLO DE ANTIOQUIA -IDEA-
120000000500010,POLITÉCNICO COLOMBIANO JAIME ISAZA CADAVID
120000000500011,SOCIEDAD DE TURÍSMO DE ANTIOQUIA S. A. -TURANTIOQUIA- EN LIQUIDACIÓN
120000000500012,UNIVERSIDAD DE ANTIOQUIA
120000000500014,INSTITUTO DEPARTAMENTAL DE DEPORTES DE ANTIOQUIA
120000000500015,DIRECCIÓN SECCIONAL DE SALUD DE ANTIOQUIA
120000000500016,AREA METROPOLITANA DEL VALLE DE ABURRA
120000000500017,E.S.P. ACUEDUCTOS Y ALCANTARILLADOS DE ANTIOQUIA S. A. -ACUANTIOQUIA- EN LIQUIDACIÓN
120000000500018,E.S.E. HOSPITAL GENERAL DE MEDELLÍN
120000000500019,E.S.E. HOSPITAL REGIONAL SAN JUAN DE DIOS
120000000500020,E.S.E. HOSPITAL LA MARÍA DE MEDELLÍN
120000000500021,INGENIO VEGACHI LTDA EN LIQUIDACIÓN OBLIGATORIA
120000000500022,DIRECCIÓN COMERCIAL DEL DEPARTAMENTO DE ANTIOQUIA
120000000500024,SOCIEDAD DE TELEVISIÓN DE ANTIOQUIA LTDA -TELEANTIOQUIA-
120000000500025,ENTIDAD ADMINISTRADORA DE PENSIONES DE ANTIOQUIA
120000000500026,E.S.P. EMPRESA ANTIOQUEÑA DE ENERGÍA S. A. -EADE-
120000000500027,E.S.E. HOSPITAL MENTAL DE ANTIOQUIA - HOMO -
120000000500028,E.S.E. CENTRO DE REHABILITACIÓN INTEGRAL EN SALUD MENTAL DE ANTIOQUIA CARISMA
120000000500029,E.S.E. HOSPITAL LA MARIA - MEDELLÍN
120000000500030,E.S.E. HOSPITAL SAN JUAN DE DIOS - ABEJORRAL
120000000500031,E.S.E. HOSPITAL SAN FERNANDO - AMAGÁ
120000000500032,E.S.E. HOSPITAL EL CARMEN - AMALFI
120000000500033,E.S.E. HOSPITAL SAN RAFAEL - ANDES
120000000500034,E.S.E. HOSPITAL LA MISERICORDIA - ANGELÓPOLIS
120000000500035,E.S.E. HOSPITAL SAN RAFAEL - ANGOSTURA
120000000500036,E.S.E. HOSPITAL SAN JUAN DE DIOS - ANORÍ
120000000500037,E.S.E. HOSPITAL REGIONAL SAN JUAN DE DIOS - SANTAFE DE ANTIOQUIA
120000000500038,E.S.E. HOSPITAL SAN FRANCISCO DE ASIS - ANZÁ
120000000500039,E.S.E. HOSPITAL ANTONIO ROLDÁN BETANCUR - APARTADO
120000000500040,E.S.E. HOSPITAL PEDRO NEL CARDONA - ARBOLETES
120000000500041,E.S.E. HOSPITAL SAN JULIAN - ARGELIA
120000000500042,E.S.E. HOSPITAL SAN MARTÍN - ARMENIA
120000000500043,E.S.E. HOSPITAL SAN VICENTE DE PAUL - BARBOSA
120000000500044,E.S.E. HOSPITAL MARCO FIDEL SUAREZ - BELLO
120000000500045,E.S.E. HOSPITAL SAN ANTONIO - BETANIA
120000000500046,E.S.E. HOSPITAL GERMÁN VÉLEZ GUTIÉRREZ - BETULIA
120000000500047,E.S.E. HOSPITAL REGIONAL LA MERCED - CIUDAD BOLÍVAR
120000000500048,E.S.E. HOSPITAL ISABEL LA CATÓLICA - CACERES
120000000500049,E.S.E. HOSPITAL SAN MIGUEL - CAICEDO
120000000500050,E.S.E. HOSPITAL REGIONAL SAN VICENTE DE PAUL - CALDAS
120000000500051,E.S.E. HOSPITAL SAGRADA FAMILIA - CAMPAMENTO
120000000500052,E.S.E. HOSPITAL SAN CARLOS - CAÑASGORDAS
120000000500053,E.S.E. HOSPITAL LOCAL DE CAREPA - CAREPA
120000000500054,E.S.E. HOSPITAL SAN ANTONIO - CARAMANTA
120000000500055,E.S.E. HOSPITAL SAN JUAN DE DIOS - CARMEN DE VIBORAL
120000000500056,E.S.E. HOSPITAL SAN RAFAEL - CAROLINA
120000000500057,E.S.E. HOSPITAL REGIONAL CESAR URIBE PIEDRAHITA - CAUCASIA
120000000500058,E.S.E. HOSPITAL MARÍA AUXILIADORA - CHIGORODO
120000000500059,E.S.E. HOSPITAL SAN ANTONIO - CISNEROS
120000000500060,E.S.E. HOSPITAL SAN JUAN DE DIOS - COCORNÁ
120000000500061,E.S.E. HOSPITAL JOSE MARIA CORDOBA - CONCEPCIÓN
120000000500062,E.S.E. HOSPITAL SAN JUAN DE DIOS - CONCORDIA
120000000500063,E.S.E. HOSPITAL SANTA MARGARITA - COPACABANA
120000000500064,E.S.E. HOSPITAL NUESTRA SEÑORA DEL PERPETUO SOCORRO - DABEIBA
120000000500065,E.S.E. HOSPITAL SAN RAFAEL - EBEJICO
120000000500066,E.S.E. HOSPITAL EMIGDIO PALACIO - ENTRERRIOS
120000000500067,E.S.E. HOSPITAL MANUEL URIBE ANGEL - ENVIGADO
120000000500068,E.S.E. HOSPITAL SANTA LUCIA - FREDONIA
120000000500069,E.S.E. HOSPITAL MARÍA A. TORO ELEJALDE - FRONTINO
120000000500070,E.S.E. HOSPITAL SAN ISIDRO - GIRALDO
120000000500071,E.S.E. HOSPITAL SAN RAFAEL - GIRARDOTA
120000000500072,E.S.E. HOSPITAL SANTA ISABEL - GÓMEZ PLATA
120000000500073,E.S.E. HOSPITAL SAN ROQUE - GRANADA
120000000500074,E.S.E. HOSPITAL NUESTRA SEÑORA DE GUADALUPE - GUADALUPE
120000000500075,E.S.E. HOSPITAL NUESTRA SEÑORA DE LA CANDELARIA - GUARNE
120000000500076,E.S.E. HOSPITAL LA INMACULADA - GUATAPE
120000000500077,E.S.E. HOSPITAL SAN JUAN DEL SUROESTE - HISPANIA
120000000500078,E.S.E. HOSPITAL SAN RAFAEL - ITAGUÍ
120000000500079,E.S.E. HOSPITAL SAN JUAN DE DIOS - ITUANGO
120000000500080,E.S.E. HOSPITAL GABRIEL PELAEZ M. - JARDÍN
120000000500081,E.S.E. HOSPITAL SAN RAFAEL - JERICÓ
120000000500082,HIDROELECTRICA PESCADERO ITUANGO S.A. E.S.P.
120000000500083,E.S.E. HOSPITAL DE LA CEJA
120000000500084,E.S.E. HOSPITAL LOCAL DE LA ESTRELLA - LA ESTRELLA
120000000500085,E.S.E. HOSPITAL SAN ROQUE - LA UNIÓN
120000000500086,E.S.E. HOSPITAL SAN LORENZO - LIBORINA
120000000500087,E.S.E. HOSPITAL MARCO A. CARDONA - MACEO
120000000500088,E.S.E. HOSPITAL SAN JUAN DE DIOS - MARINILLA
120000000500089,E.S.E. HOSPITAL SAN ANTONIO - MONTEBELLO
120000000500090,E.S.E. HOSPITAL LA ANUNCIACIÓN - MUTATA
120000000500091,E.S.E. HOSPITAL SAN JOAQUIN - NARIÑO
120000000500092,E.S.E. HOSPITAL LA MISERICORDIA - NECHÍ
120000000500093,E.S.E. HOSPITAL SAN SEBASTIAN DE URABA - NECOCLÍ
120000000500094,E.S.E. HOSPITAL SAN JUAN DE DIOS - PEÑOL
120000000500095,E.S.E. HOSPITAL SAN FRANCISCO - PEQUE
120000000500096,E.S.E. HOSPITAL SAN VICENTE DE PAUL - PUEBLORRICO
120000000500097,E.S.E. HOSPITAL LA CRUZ - PUERTO BERRIO
120000000500098,E.S.E. HOSPITAL LA PAZ - PUERTO TRIUNFO
120000000500099,E.S.E. HOSPITAL SAN VICENTE DE PAUL - REMEDIOS
120000000500102,CORPORACIÓN DE VIVIENDA Y DESARROLLO SOCIAL -CORVIDE- EN LIQUIDACIÓN
120000000500103,EMPRESA DE TRANSPORTE MASIVO DEL VALLE DE ABURRA -METROMEDELLÍN-
120000000500104,EMPRESAS PÚBLICAS DE MEDELLÍN
120000000500105,EMPRESAS VARIAS DE MEDELLÍN
120000000500106,INSTITUTO METROPOLITANO DE VALORIZACIÓN - MEDELLÍN
120000000500107,TERMINAL DE TRANSPORTE DE MEDELLÍN S. A.
120000000500108,FONDO DE FOMENTO Y TURÍSMO - MEDELLÍN
120000000500109,FONDO DE FOMENTO DEL DEPORTE - MEDELLÍN
120000000500110,FONDO DE PROTECCIÓN ESCOLAR - MEDELLÍN
120000000500111,FONDO DE UNIDADES INTERMEDIAS DE SALUD - MEDELLÍN
120000000500112,FONDO DE TRANSPORTE Y TRÁNSITO
120000000500113,FONDO DE FARMACIA
120000000500114,FONDO DE BIENESTAR SOCIAL
120000000500115,FONDO MUNICIPAL DE VIVIENDA DE MEDELLÍN
120000000500116,FONDO DE CONSTRUCCIÓN DE PARQUES - MEDELLÍN
120000000500117,FONDO METROPOLITANO DE SEGURIDAD -METROSEGURIDAD-
120000000500118,METROMEZCLAS DE MEDELLÍN LTDA
120000000500119,PALACIO DE EXP. Y CONVENCIONES DE MEDELLÍN S. A.
120000000500120,INSTITUTO METROPOLITANO SALUD-METROSALUD-MEDELLÍN
120000000500121,AEROPARQUE OLAYA HERRERA DE MEDELLÍN
120000000500122,INSTITUTO TECNOLÓGICO METROPOLITANO - MEDELLÍN
120000000500123,ASOCIACIÓN CANAL LOCAL DE TELEVISIÓN DE MEDELLÍN -TELEMEDELLÍN-
120000000500124,INSTITUTO MUNICIPAL RECREACIÓN Y DEPORTE -INDER MEDELLÍN-
120000000500125,SOCIEDAD TERMINALES DE TRANSPORTE - MEDELLÍN
120000000500126,INSTITUTO PARA EL MANEJO INTEGRAL CUENCA RIO MEDELLÍN -MI RIO- EN LIQUIDACIÓN
120000000500127,EPM INVERSIONES S.A.
120000000500128,FONDO ACUMULATIVO UNIVERSITARIO DE LA UNIVERSIDAD DE ANTIOQUIA
120000000500129,CORPORACIÓN RECREATIVA METROPOLITANA DE MEDELLÍN - METROPARQUES -
120000000500130,E.S.P. ORBITEL S.A.
120000000500131,AGENCIA PARA LA COOPERACIÓN INTERNACIONAL DE MEDELLÍN - ACI
120000000500132,EMPRESA DE DESARROLLO URBANO DE MEDELLÍN -EDU-
120000000500133,E.S.P. EPM MEDELLÍN TELECOMUNICACIONES S. A.
120000000500134,FUNDACIÓN EMPRESAS PÚBLICAS DE MEDELLÍN
120000000500135,ESCOMBROS SOLIDOS ADECUADOS LTDA
120000000500136,METROPLUS S.A.
120000000500201,E.S.P. EMPRESAS PÚBLICAS DE ABEJORRAL
120000000502101,INSTITUTO MUNICIPAL DE DEPORTES Y RECREACIÓN DE ALEJANDRÍA
120000000503401,E.S.P. EMPRESAS PÚBLICAS DE ANDES
120000000503402,INDEPORTES - ANDES
120000000504501,TERMINAL DE TRANSPORTE DE APARTADÓ
120000000504502,E.S.P. EMPRESAS PÚBLICAS DE APARTADÓ - APARTADÓ
120000000504503,E.S.P. URABA LIMPIO S.A.
120000000504504,PLAZA DE MERCADO DE APARTADO
120000000504505,EMPRESA AUTÓNOMA DE APARTADO
120000000505101,INSTITUTO MUNICIPAL DE DEPORTES DE ARBOLETES - IMDERAR
120000000508601,E.S.P. DE BELMIRA
120000000508801,E.S.E. HOSPITAL ROSALPI
120000000508802,E.S.E. PARIS ACEVEDO FONTIDUEÑO
120000000509101,INSTITUTO MUNICIPAL PARA EL DEPORTE LA RECREACIÓN Y LA EDUCACIÓN FISICA - IMDERBETA BETANIA
120000000510101,E.S.P. NUESTRO ASEO
120000000512501,INSTITUTO PARA EL DEPORTE Y LA RECREACIÓN - INDERCA CAICEDO
120000000512901,CASA MUNICIPAL DE LA CULTURA DE CALDAS
120000000512902,INSTITUTO DE DEPORTES Y RECREACIÓN DE CALDAS
120000000514801,E.S.P. LA CIMARRONA - CARMEN DE VIBORAL
120000000515402,E.S.P. EMPRESAS PÚBLICAS MUNICIPALES DE CAUCASIA EN LIQUIDACIÓN
120000000517201,INSTITUTO MUNICIPAL DE VIVIENDA PARA EL DESARROLLO SOCIAL DE CHIGORODÓ - IMVIDES
120000000517202,INSTITUTO MUNICIPAL DE DEPORTE Y RECREACIÓN IMDER - CHIGORODÓ
120000000517203,E.S.P. EMPRESA PRESTADORA DE SERVICIO PÚBLICO DE ASEO - CHIGORODÓ
120000000519701,E.S.P. EMPRESA DE SERVICIOS PÚBLICOS - COCORNÁ
120000000520601,FONDO DE VIVIENDA DE INTERES SOCIAL
120000000520901,E.S.P. EMPRESAS PÚBLICAS DE CONCORDIA
120000000521201,JUNTA DE DEPORTES COPACABANA
120000000523701,FONDO DE VIVIENDA DE INTERÉS SOCIAL Y REFORMA URBANA - DONMATIAS
120000000523702,E.S.P. SERVICIOS PÚBLICOS DOMICILIARIOS - DON MATÍAS
120000000524001,E.S.P. EMPRESA DE SERVICIOS PÚBLICOS DE EBEJICO
120000000525001,FONDO DE VIVIENDAD DE INTERES SOCIAL - FOVIS - EL BAGRE
120000000525002,EMPRESAS PÚBLICAS DE EL BAGRE
120000000526601,INSTITUCIÓN UNIVERSITARIA DE ENVIGADO
120000000526602,E.S.P. ENVIASEO DE ENVIGADO
120000000526603,INSTITUTO DE DEPORTES RECREACIÓN Y APROVECHAMIENTO DEL TIEMPO LIBRE ENVIGADO - INDER
120000000526604,ESCUELA SUPERIOR TECNOLÓGICA DE ARTES DÉBORA ARANGO
120000000528401,E.S.P. EMPRESA DE SERVICIOS PÚBLICOS DE FRONTINO
120000000530801,INSTITUTO GIRARDOTANO DEL DEPORTE LA RECREACIÓN Y EL APROVECHAMIENTO DEL TIEMPO LIBRE - IGDER
120000000531301,E.S.P. EMPRESAS DE SERVICIOS PÚBLICOS - GRANADA
120000000531801,E.S.P. EMPRESA DE SERVICIOS PÚBLICOS DE GUARNE
120000000531802,INSTITUTO DEL DEPORTE LA RECREACIÓN Y APROVECHAMIENTO DEL TIEMPO LIBRE - INDER GUARNE
120000000532101,INSTITUTO DE DEPORTES Y RECREACIÓN - INDER GUATAPÉ
120000000532102,EMPRESA AUTÓNOMA DEL MUNICIPIO DE GUATAPE -AGUATAPE S.A.
120000000532103,E.S.P. DOMICILIARIOS DEL MUNICIPIO DE GUATAPÉ
120000000536002,DEPARTAMENTO ADMINISTRATIVO DE VALORIZACIÓN DE ITAGÜÍ
120000000536003,INSTITUTO MUNICIPAL DE VIVIENDA DE INTERES SOCIAL Y REFORMA URBANA -IMVIR-
120000000536004,E.S.E. HOSPITAL DEL SUR GABRIEL JARAMILLO PIEDRAHITA
120000000536401,UNIDAD MUNICIPAL PRESTADORA DE SERVICIOS PÚBLICOS DOMICILIARIOS - JUSPU JARDÍN
120000000536801,JUNTA MUNICIPAL DE DEPORTES DE JERICÓ
120000000537601,FUNDACIÓN UNIVERSITARIA ORIENTE DE ANTIOQUIA - LA CEJA
120000000537602,E.S.P. EMPRESAS PÚBLICAS MUNICIPALES DE LA CEJA
120000000537603,INSTITUTO CEJEÑO DE LA RECREACIÓN Y EL DEPORTE -INCERDE- LA CEJA
120000000537604,FONDO DE VIVIENDA DE INTERES SOCIAL Y REFORMA URBANA DE LA CEJA DEL TAMBO
120000000537605,E.S.P. EMPRESAS PUBLICAS MUNICIPALES DE LA CEJA DEL TAMBO
120000000537606,INSTITUTO DE CULTURA Y TURISMO - MUNICIPIO DE LA CEJA
120000000537607,CENTRO DIA GERONTOLÓGICO - LA CEJA DEL TAMBO
120000000538001,INSTITUTO MUNICIPAL DEL DEPORTE Y RECREACIÓN DE LA ESTRELLA - INDERE
120000000539001,E.S.E. HOSPITAL ANTONIO ROLDAN - LA PINTADA
120000000540001,E.S.P. EMPRESA DE SERVICIOS PÚBLICOS - LA UNIÓN
120000000544001,INSTITUTO DE DEPORTES DE MARINILLA INDERMA
120000000544002,E.S.P. EMPRESA DE SERVICIOS PÚBLICOS DE ASEO- SAN JOSE DE MARINILLA
120000000547501,E.S.P. EMPRESA DE ENERGÍA ELECTRICA DE SERVICIOS PUBLICOS - MURINDO
120000000554101,EMPRESA AGROINDUSTRIAL DEL ORIENTE EMBALSES S.A. ACOPEÑOL S.A.
120000000557901,FONDO DE VIVIENDA DE INTERES SOCIAL DE PUERTO BERRIO - FOVIS
120000000557902,INSTITUTO DE DEPORTE LA RECREACIÓN Y APROVECHAMIENTO DEL TIEMPO LIBRE - PUERTO BERRIO
120000000558501,EMPRESAS PÚBLICAS DE PUERTO NARE
120000000558502,FRIGONARE
120000000560401,FONDO DE FOMENTO MINERO Y PROTECCION AMBIENTAL DEL MUNICIPIO DE REMEDIOS
120000000560701,E.S.P. EMPRESA DE AGUAS DEL ORIENTE ANTIOQUEÑO S. A. - EL RETIRO
120000000561501,E.S.E. HOSPITAL GILBERTO MEJIA MEJIA
120000000561502,INSTITUTO MUNICIPAL DE EDUCACIÓN FÍSICA DEPORTE Y RECREACIÓN - IMER RIONEGRO ANTIOQUIA
120000000561503,E.S.P. AGUAS DE RIONEGRO S. A.
120000000563101,INSTITUTO PARA EL DEPORTE Y LA RECREACIÓN INDESA - SABANETA
120000000563102,FONDO DE VIVIENDA DE INTERÉS SOCIAL Y REFORMA URBANA DE SABANETA ANTIOQUIA
120000000563103,EMPRESA DE ALUMBRADO PÚBLICO - SABANETA
120000000564201,E.S.P. SIMA - SALGAR
120000000565601,E.S.P. AGUAS DE SAN JERÓNIMO
120000000566001,E.S.P. EMPRESA DE SERVICIOS PÚBLICOS- SAN LUIS ANTIOQUIA
120000000566002,FONDO DE VIVIENDA - SAN LUIS ANTIOQUIA
120000000567001,JUNDEPORTES SAN ROQUE
120000000567002,FONDO DE VIVIENDA DE INTERES SOCIAL Y REFORMA URBANA SAN ROQUE
120000000567401,COMERCIALIZADORA LÍDER DEL ORIENTE - COLIDER
120000000569001,FONDO DE VIVIENDA DE INTERES SOCIAL DEL MUNICIPIO DE SANTO DOMINGO
120000000569002,E.S.P. DE SANTO DOMINGO
120000000569701,E.S.P. EMPRESAS PÚBLICAS DE EL SANTUARIO
120000000573601,FONDO DE VIVIENDA DE INTERÉS SOCIAL Y REFORMA URBANA - FOVIS - SEGOVIA
120000000573602,FONDO DE FOMENTO A LA MINERIA Y AL MEDIO AMBIENTE - SEGOVIA
120000000576101,E.S.P. EMPRESAS PUBLICAS MUNICIPALES DE SOPETRAN
120000000583701,INSTITUTO MUNICIPAL DE DEPORTES IMDEPORTES - TURBO
120000000584701,EMPRESAS PÚBLICAS MUNICIPALES DE URRAO
120000000584702,FONDO DE VIVIENDA DE INTERÉS SOCIAL -FOVIS- DE URRAO
120000000586101,EMPRESA PRESTADORA DEL SERVICIO PÚBLICO DE ASEO DE VENECIA
120000000587301,E.S.P. DE VIGIA DEL FUERTE EMSPUVIF
120000000588701,FUNDACIÓN UNIVERSITARIA DEL NORTE DE ANTIOQUIA - YARUMAL
120000000588702,EMPRESAS PÚBLICAS MUNICIPALES DE YARUMAL
120000000588703,INSTITUTO DE DEPORTES Y RECREACIÓN DE YARUMAL -INDERYAL-
120000000589001,INSTITUTO DE DEPORTES RECREACIÓN Y EDUCACIÓN FÍSICA - YOLOMBÓ
120000000589301,E.S.P. EMPRESA DE SERVICIOS PÚBLICOS DOMICILIARIOS DE ACUEDUCTO ALCANTARILLADO Y ASEO DE YONDÓ
120000000589501,E.S.E. HOSPITAL SAN RAFAEL - ZARAGOZA
120000000800001,EMPRESA DE LOTERÍAS Y APUESTAS PERMANENTES DEL ATLÁNTICO
120000000800002,FABRICA DE LICORES DEL ATLÁNTICO
120000000800003,LOTERÍA DEL ATLÁNTICO
120000000800004,UNIVERSIDAD DEL ATLÁNTICO
120000000800006,JUNTA ADMINISTRADORA DE DEPORTES DEL ATLÁNTICO
120000000800007,DEPARTAMENTO ADMINISTRATIVO DE SALUD DEL ATLÁNTICO
120000000800008,FONDO EDUC. SUPERIOR OFICIAL RECREACIÓN Y DEPORTE
120000000800009,EMPRESA INDUSTRIAL Y COMERCIAL -METROFUTBOL-
120000000800010,INSTITUTO PARA EL DESARROLLO DEL ATLÁNTICO INDAT
120000000800011,CAJA DE PREVISIÓN SOCIAL DEPARTAMENTAL - ATLÁNTICO
120000000800012,HOSPITAL UNIVERSITARIO DE BARRANQUILLA
120000000800013,HOSPITAL MENTAL DEPARTAMENTAL DE BARRANQUILLA
120000000800014,HOSPITAL PEDIATRICO DE BARRANQUILLA
120000000800015,FONDO ROTATORIO DE VALORIZACIÓN DEPARTAMENTAL DEL ATLÁNTICO
120000000800016,INSTITUTO DEPARTAMENTAL TRÁNSITO Y TRANSPORTE ATLÁNTICO
120000000800017,GRAN CENTRAL DE ABASTOS DEL CARIBE S. A.
120000000800018,EMPRESA DE OBRAS SANITARIAS DEL ATLÁNTICO
120000000800019,FONDO MIXTO PROMOCIÓN CULTURA Y ARTES - ATLÁNTICO
120000000800020,E.S.E. HOSPITAL GENERAL DE BARRANQUILLA EN LIQUIDACIÓN
120000000800021,E.S.E. HOSPITAL NAZARETH
120000000800022,TRIBUNAL DE ÉTICA MÉDICA DEL ATLÁNTICO
120000000800023,INSTITUTO DEPARTAMENTAL DE RECREACIÓN Y DEPORTES DEL ATLÁNTICO - INDEPORTES ATLÁNTICO
120000000800024,E.S.E. HOSPITAL LOCAL - BARANOA
120000000800025,E.S.E. HOSPITAL DE PUERTO COLOMBIA
120000000800026,E.S.E. CENTRO DE SALUD DE SABANALARGA
120000000800027,E.S.E. HOSPITAL DEPARTAMENTAL JUAN DOMINGUEZ ROMERO DE SOLEDAD
120000000800028,E.S.E HOSPITAL LA MANGA
120000000800029,E.S.E. HOSPITAL NIÑO JESUS - BARRANQUILLA
120000000800030,E.S.E. RED PÚBLICA HOSPITALARIA DE BARRANQUILLA - REDHOSPITAL
120000000800031,E.S.E. HOSPITAL LOCAL DE CAMPO DE LA CRUZ
120000000800032,E.S.E. HOSPITAL LOCAL - LURUACO
120000000800033,E.S.E. HOSPITAL DE SANTO TOMAS
120000000800101,E.S.P. EMPRESA DISTRITAL DE TELECOMUNICACIONES BARRANQUILLA EN LIQUIDACIÓN
120000000800102,FONDO ROTATORIO DE VALORIZACIÓN MUNICIPAL BARRANQUILLA EN LIQUIDACIÓN
120000000800103,EMPRESAS PÚBLICAS MUNICIPALES DE BARRANQUILLA
120000000800104,CAJA DE PREVISIÓN SOCIAL MUNICIPAL DE BARRANQUILLA
120000000800105,TERMINAL DE TRANSPORTES DE BARRANQUILLA S. A.
120000000800106,EMPRESA DE DESARROLLO URBANO DE BARRANQUILLA LTDA
120000000800107,ÁREA METROPOLITANA DE BARRANQUILLA
120000000800108,SOCIEDAD DE ACUEDUCTO ALCANTARILLADO Y ASEO DE BARRANQUILLA S. A.
120000000800109,E.S.P. BARRANQUILLA TELECOMUNICACIONES S.A. - BATELSA
120000000800110,E.S.E. CENTRO DE ATENCIÓN Y REHABILITACIÓN INTEGRAL EN SALUD -CARI- BARRANQUILLA
120000000800111,INSTITUTO DISTRITAL TRANSPORTE Y TRÁNSITO - BARRANQUILLA
120000000800112,INSTITUTO DISTRITAL DE CULTURA - BARRANQUILLA
120000000800113,INSTITUTO DISTRITAL RECREACIÓN Y DEPORTE - BARRANQUILLA
120000000800114,FONDO DISTRITAL DE VIVIENDA DE INTERES SOCIAL Y REFORMA URBANA EN LIQUIDACIÓN
120000000800115,DEPARTAMENTO ADMINISTRATIVO DISTRITAL DEL MEDIO AMBIENTE - DADIMA
120000000800116,BARRANQUILLA SANA E.P.S. - EN LIQUIDACIÓN
120000000800117,E.S.P. URBANO DE TRANSPORTE MASIVO DE PASAJEROS TRANSMETRO S.A.
120000000800118,CORPORACIÓN DISTRITAL DE RECREACIÓN Y DEPORTES DE BARRANQUILLA . CORDEPORTES
120000000800119,FONDO MIXTO DE PROMOCION PROTECCIÓN Y APOYO AL CARNAVAL DE BARRANQUILLA COMO PATRIMONIO ORAL E INMATERIAL DE LA HUMANIDAD
120000000800120,FONDO DE INVERSIONES PARA LA SEGURIDAD Y LA CONVIVENCIA CIUDADANA - FONSECON
120000000800121,CONSEJERIA ESPECIAL PARA ASUNTOS PORTUARIOS - BARRANQUILLA
120000000800122,FONDO DISTRITAL DE RECUPERACIÓN HIDRICA Y OBRAS AMBIENTALES - FORO AMBIENTAL
120000000800123,INSTITUTO DISTRITAL DE URBANISMO Y CONTROL
120000000800124,BANCO INMOBILIARIO METROPOLITANO
120000000800125,SUPERINTENDENCIA DISTRITAL DE LIQUIDACIONES
120000000814101,E.S.E. HOSPITAL DE CANDELARIA
120000000829601,E.S.E CENTRO DE SALUD GALAPA - ATLANTICO
120000000837201,E.S.E. HOSPITAL DE JUAN DE ACOSTA
120000000842101,E.S.P. EMPRESA DE SERVICIOS PÚBLICOS DOMICILIARIOS - LURUACO SERVILUR
120000000843301,E.S.E. HOSPITAL LOCAL DE MALAMBO
120000000843302,INSTITUTO MUNICIPAL DE DEPORTES DE MALAMBO
120000000843303,INSTITUTO DE CULTURA DE MALAMBO
120000000843601,E.S.E. HOSPITAL DEL MUNICIPIO DE MANATI
120000000852001,E.S.E. CENTRO DE SALUD PALMAR DE VARELA
120000000854901,E.S.E. HOSPITAL VERA JUDITH IMITOLA VILLANUEVA - PIOJÓ
120000000855801,E.S.E. CENTRO DE SALUD DE POLONUEVO
120000000856001,E.S.E. HOSPITAL DE PONEDERA
120000000860601,E.S.E. HOSPITAL LOCAL DE REPELÓN
120000000860602,EMPRESA DE ACUEDUCTO Y ALCANTARILLADO Y ASEO DE REPELON
120000000863401,E.S.E. CENTRO DE SALUD SABANAGRANDE
120000000863801,E.S.E CEMINSA
120000000867501,E.S.E. CENTRO DE SALUD SANTA LUCIA - ATLANTICO
120000000875801,INSTITUTO MUNICIPAL DEL DEPORTE Y RECREACIÓN - SOLEDAD
120000000875802,FONDO DE VIVIENDA DE INTERES SOCIAL SOLEDAD
120000000875803,E.S.E. HOSPITAL MATERNO INFANTIL CIUDADELA METROPOLITANA - SOLEDAD
120000000875804,INSTITUTO MUNICIPAL DE LA CULTURA DE SOLEDAD
120000000877001,EMPRESA DE ACUEDUCTO - SUAN
120000000877002,E.S.E. CENTRO DE SALUD SUAN - ATLANTICO
120000000883201,E.S.E. CENTRO DE SALUD DE TUBARÁ - TUBARÁ
120000000883202,EMPRESA DE SERVICIOS PÚBLICOS DE ACUEDUCTO ALCANTARILLADO Y ASEO - TUBARÁ
120000000884901,E.S.E. CENTRO DE SALUD DE USIACURI
120000001100101,CAJA DE PREVISIÓN SOCIAL DISTRITAL
120000001100102,CAJA DE VIVIENDA POPULAR DEL DISTRITO CAPITAL
120000001100103,CENTRO DISTRITAL DE SISTEMATIZACIÓN Y SERVICIOS TÉCNICOS -SISE- EN LIQUIDACIÓN
120000001100104,INSTITUTO DISTRITAL DE PATRIMONIO CULTURAL
120000001100105,E.S.P. EMPRESA DE ACUEDUCTO Y ALCANTARILLADO DE BOGOTÁ
120000001100106,E.S.P. EMPRESA DE ENERGÍA ELÉCTRICA DE BOGOTÁ S. A.
120000001100107,EMPRESA DISTRITAL DE SERVICIOS PÚBLICOS -EDIS-
120000001100108,E.S.P. EMPRESA DE TELECOMUNICACIONES DE SANTAFE DE BOGOTÁ S. A.
120000001100109,EMPRESA DISTRITAL DE TRANSPORTES URBANOS -EDTU-
120000001100110,FONDO DE AHORRO Y VIVIENDA DISTRITAL -FAVIDI-
120000001100111,FONDO DE VIGILANCIA Y SEGURIDAD DE BOGOTÁ
120000001100112,FUNDACIÓN GILBERTO ALZATE AVENDAÑO
120000001100113,INSTITUTO DE DESARROLLO URBANO -IDU-
120000001100114,INSTITUTO DISTRITAL DE CULTURA Y TURÍSMO
120000001100115,INSTITUTO DISTRITAL PARA LA PROTECCIÓN DE LA NIÑEZ Y DE LA JUVENTUD -IDIPRON-
120000001100116,INSTITUTO DISTRITAL PARA LA RECREACIÓN Y EL DEPORTE -IDRD-
120000001100117,LOTERÍA DE BOGOTÁ
120000001100118,ORQUESTA FILARMÓNICA DE BOGOTÁ
120000001100119,UNIVERSIDAD DISTRITAL FRANCISCO JOSÉ DE CALDAS
120000001100121,JUNTA ADMINISTRADORA DEPORTES DE BOGOTÁ D.C.
120000001100122,FONDO FINANCIERO DE SALUD DEL DISTRITO
120000001100123,FONDO ROTATORIO DE LABORATORIO DE SUELOS
120000001100124,FONDO DE EDUCACIÓN Y SEGURIDAD VIAL -FONDATT-
120000001100125,FONDO ROTATORIO DE LA SECRETARÍA DE EDUCACIÓN -FONSED-
120000001100126,FONDO DE ASISTENCIA COMUNAL
120000001100127,FONDO DE VENTAS POPULARES DE SANTAFE DE BOGOTÁ
120000001100128,FONDO ROTATORIO DEL DEPARTAMENTO ADMINISTRATIVO DE BIENESTAR SOCIAL -FONDABS-
120000001100129,FONDO DE BOMBEROS DE BOGOTÁ D.C.
120000001100130,FONDO ROTATORIO DE PUBLICACIONES HELIOGRÁFICAS
120000001100131,JARDÍN BOTÁNICO JOSÉ CELESTINO MUTIS
120000001100132,FONDO DE SALUD MENTAL Y ASISTENCIA AL ANCIANO DESAMPARADO
120000001100133,TERMINAL DE TRANSPORTE S. A.
120000001100134,FONDO ROTATORIO VIAL DISTRITAL DE LA SECRETARÍA DE OBRAS PÚBLICAS
120000001100135,FONDO DE PREVENCIÓN Y ATENCIÓN DE EMERGENCIAS -FOPAE-
120000001100136,FONDOS DE DESARROLLO LOCAL
120000001100137,FONDO ROTATORIO DEL CONCEJO DE SANTAFE DE BOGOTÁ
120000001100138,HOSPITALES DISTRITO CAPITAL
120000001100139,INSTITUTO PARA LA INVESTIGACIÓN EDUCATIVA Y EL DESARROLLO PEDAGÓGICO
120000001100140,CANAL CAPITAL LTDA
120000001100141,EMPRESA DE TRANSPORTE DEL TERCER MILENIO S. A. -TRANSMILENIO-
120000001100142,E.S.P. EPM BOGOTÁ TELECOMUNICACIONES S. A.
120000001100143,E.S.P. EPM BOGOTÁ AGUAS S. A.
120000001100144,E.I.C.E. METROVIVIENDA
120000001100145,E.S.E. HOSPITAL OCCIENTE DE KENNEDY
120000001100146,E.S.E. HOSPITAL CENTRO ORIENTE
120000001100147,E.S.E. HOSPITAL FONTIBÓN
120000001100148,E.S.E. HOSPITAL DE ENGATIVÁ - II NIVEL
120000001100149,E.S.E. HOSPITAL DE BOSA
120000001100150,E.S.E. HOSPITAL EL TUNAL
120000001100151,E.S.E. HOSPITAL SAN BLAS II
120000001100152,E.S.E. HOSPITAL LA VICTORIA
120000001100153,E.S.E. HOSPITAL DE SUBA
120000001100154,E.S.E. HOSPITAL DE USAQUEN
120000001100155,E.S.E. HOSPITAL DE USME
120000001100156,E.S.E. HOSPITAL DE MEISSEN
120000001100157,E.S.E. HOSPITAL SIMON BOLÍVAR
120000001100158,E.S.E. HOSPITAL NAZARETH - BOGOTÁ
120000001100159,E.S.E. HOSPITAL PABLO VI - BOSA
120000001100160,E.S.E. HOSPITAL SANTA CLARA
120000001100161,E.S.E. HOSPITAL VISTAHERMOSA
120000001100162,E.S.E. HOSPITAL DEL SUR
120000001100163,E.S.E HOSPITAL CHAPINERO
120000001100164,E.S.E. RAFAEL URIBE URIBE - PRIMER NIVEL
120000001100165,E.S.E. HOSPITAL TUNJUELITO II NIVEL
120000001100166,E.S.E. HOSPITAL SAN CRISTOBAL
120000001100167,E.S.P. COLVATEL S.A.
120000001100168,CORPORACIÓN DE ABASTOS DE BOGOTÁ S. A. -CORABASTOS-
120000001100169,E.S.P. AGUAS DE BOGOTA S.A.
120000001100170,E.S.P. COLOMBIA MOVIL S.A.
