120000001100171,E.S.P. TRANSPORTADORA COLOMBIANA DE GAS S.A. - TRANSCOGAS
120000001100172,E.S.P. GESTAGUAS S.A.
120000001100173,EMPRESA DE RENOVACIÓN URBANA DE BOGOTÁ
120000001300001,FONDO DE PREVISIÓN SOCIAL DE BOLÍVAR
120000001300002,FONDO DE TRÁNSITO Y TRANSPORTE DE BOLÍVAR
120000001300003,INDUSTRIA LICORERA DE BOLÍVAR -INDULIBOL- EN LIQUIDACIÓN
120000001300004,LOTERÍA DE BOLÍVAR
120000001300006,JUNTA ADMINISTRADORA DE DEPORTES DE BOLÍVAR
120000001300008,CENTRO CAPACITACIÓN RECURSO HUMANO SALUD - CARTAGENA
120000001300009,E.S.E. HOSPITAL SANATORIO SAN PABLO DE CARTAGENA
120000001300010,E.S.E. HOSPITAL REGIONAL DE BOLIVAR
120000001300011,E.S.E. HOSPITAL UNIVERSITARIO DE CARTAGENA EN LIQUIDACIÓN
120000001300012,CLINICA DE MATERNIDAD RAFAEL CALVO
120000001300013,DISTRITO INTEGRADO DE SALUD DE CARTAGENA
120000001300014,CAJA DE PREVISIÓN SOCIAL DE LA UNIVERSIDAD DE CARTAGENA
120000001300015,E.S.E. HOSPITAL MONTE CARMELO DE EL CARMEN DE BOLIVAR
120000001300016,E.S.E. HOSPITAL SAN JUAN DE DIOS - MOMPOX
120000001300017,E.S.E. HOSPITAL SAN JUDAS TADEO DE SIMITI
120000001300018,FONDO MIXTO PARA LA PROMOCION DE LA CULTURA Y LAS ARTES.
120000001300019,INSTITUTO DEPARTAMENTAL DE DEPORTES Y RECREACIÓN DE BOLIVAR - INDERBOL
120000001300020,FONDO DE VIVIENDA DE INTERES SOCIAL - FONVIBOLIVAR
120000001300021,ESCUELA SUPERIOR DE BELLAS ARTES DE CARTAGENA DE INDIAS
120000001300022,E.S.E. HOSPITAL SAN JUAN DE DIOS - MAGANGUE
120000001300023,FONDO DEPARTAMENTAL DE FOMENTO MICROEMPRESARIAL - FONDEMIC
120000001300101,EMPRESA PROMOTORA TURÍSMO FERIAS ESPECTÁCULOS PÚBLICOS - CARTAGENA
120000001300102,EMPRESA DE SERVICIOS PÚBLICOS DISTRITALES DE CARTAGENA EN LIQUIDACIÓN
120000001300103,EMPRESA DE TELECOMUNICACIONES DE CARTAGENA
120000001300104,OFICINA DE VALORIZACIÓN MUNICIPAL - CARTAGENA
120000001300105,UNIVERSIDAD DE CARTAGENA
120000001300106,EMPRESAS DE DESARROLLO URBANO DE BOLÍVAR S. A. -EDURBE-
120000001300107,EMPRESA COMERCIAL FERIAS TAURINAS Y ESPECTÁCULOS PÚBLICOS
120000001300108,TRANSCARIBE S.A.
120000001300109,TERMINAL DE TRANSPORTE DE CARTAGENA S. A.
120000001300110,E.S.E. HOSPITAL LOCAL CARTAGENA DE INDIAS - CARTAGENA DE INDIAS
120000001300111,FONDO DE VIVIENDA DE INTERES SOCIAL Y REFORMA URBANA DISTRITAL - CORVIVIENDA
120000001300112,FONDO MIXTO DE PROMOCION DE LA CULTURA Y LAS ARTES DE CARTAGENA
120000001300113,LOTERIA LA CARTAGENERA
120000001300114,E.S.P. AGUAS DE CARTAGENA S.A.
120000001300115,INSTITUTO DISTRITAL DE DEPORTES Y RECREACION DE CARTAGENA
120000001300116,ESTABLECIMIENTO PÚBLICO AMBIENTAL - CARTAGENA
120000001300117,INSTITUTO DE PATRIMONIO Y CULTURA DE CARTAGENA
120000001300118,DISTRISEGURIDAD
120000001300119,E.S.E. HOSPITAL SAN PABLO DE CARTAGENA
120000001304201,E.S.E. HOSPITAL LOCAL DE ARENAL MANUELA PABUENA LOBO - ARENAL
120000001305201,E.S.E. HOSPITAL LOCAL DE ARJONA
120000001305202,ACUEDUCTO REGIONAL DE ARJONA - TURBACO Y TURBANA
120000001306201,E.S.E. CENTRO DE SALUD CON CAMA - ARROYOHONDO
120000001307401,E.S.E. HOSPITAL JOSÉ RUDECINDO LÓPEZ PARODI - BARRANCO DE LOBA
120000001314001,E.S.E. HOSPITAL LOCAL CALAMAR - CALAMAR
120000001318801,E.S.E. HOSPITAL LOCAL DE CICUCO
120000001321201,E.S.E. CENTRO DE SALUD CON CAMAS DE CORDOBA - BOLIVAR
120000001324401,E.S.E. CENTRO DE SALUD GIOVANI CRISTINI - CARMEN DE BOLIVAR
120000001324402,JUNTA MUNICIPAL DE DEPORTE EL CARMEN DE BOLÍVAR
120000001343002,EMPRESA DE DESARROLLO URBANO DE MAGANGUE
120000001343004,E.S.P. EMPRESA DE ENERGÍA ELÉCTRICA DE MAGANGUE S. A. EN LIQUIDACIÓN
120000001343005,EMPRESA DE SERVICIOS PÚBLICOS DE MAGANGUE -SERVIMAG-
120000001343006,E.S.E. DEL MUNICIPIO DE MAGANGUÉ
120000001343007,FONDO MUNICIPAL DE TRÁNSITO Y TRANSPORTE DE MAGANGUÉ
120000001343301,E.S.E. HOSPITAL LOCAL MAHATES - MAHATES (BOLIVAR)
120000001344001,E.S.E. CENTRO DE SALUD DE MARGARITA - BOLIVAR
120000001344201,E.S.E . HOSPITAL LOCAL MARÍA LA BAJA
120000001346801,EMPRESA DE SERVICIOS PÚBLICOS DE MOMPOS -SERVIMOMPOS-
120000001346802,E.S.E. HOSPITAL LOCAL SANTA MARÍA - SANTA CRUZ DE MOMPOX
120000001347301,E.S.E. HOSPITAL LOCAL SAN SEBASTIAN - MORALES
120000001360001,E.S.E. HOSPITAL LOCAL LA CANDELARIA - RIOVIEJO
120000001364701,E.S.E. HOSPITAL LOCAL ANA MARÍA RODRÍGUEZ - SAN ESTANISLAO DE KOTSKA
120000001365001,E.S.E. HOSPITAL LOCAL SAN FERNANDO - SAN FERNANDO
120000001365501,E.S.E. CENTRO DE SALUD CON CAMA
120000001365701,EMPRESA MUNICIPAL DE SERVICIOS PÚBLICOS DE SAN JUAN NEPOMUCENO
120000001365702,E.S.E. HOSPITAL LOCAL DE SAN JUAN NEPOMUCENO
120000001365703,INSTITUTO DE DEPORTE Y RECREACIÓN DE SAN JUAN NEPOMUCENO
120000001365704,CASA DE LA CULTURA DE SAN JUAN NEPOMUCENO
120000001366701,E.S.E. HOSPITAL LOCAL SAN MARTIN DE LOBA
120000001367001,E.S.E. HOSPITAL LOCAL SAN PABLO - SAN PABLO
120000001368801,E.S.E. HOSPITAL MANUEL ELKIN PATARROYO - SANTA ROSA DEL SUR
120000001376001,E.S.E. CENTRO DE SALUD CON CAMA VITALIO SARA CASTILLO - SOPLAVIENTO
120000001378001,E.S.E. HOSPITAL LOCAL TALAIGUA NUEVO - BOLIVAR
120000001383601,E.S.E. HOSPITAL LOCAL - TURBACO
120000001383801,E.S.E. HOSPITAL LOCAL TURBANA - TURBANA
120000001387301,E.S.P. EMPRESA INTERMUNICIPAL DE SERVICIOS PUBLICOS DOMICILIARIOS DE ACUEDUCTO Y ALCANTARILLADO S.A.
120000001389401,E.S.E. HOSPITAL LOCAL SAN SEBASTIÁN DEL MUNICIPIO DE ZAMBRANO - ZAMBRANO
120000001500001,BENEFICENCIA Y LOTERÍA DE BOYACÁ
120000001500002,CAJA DE PREVISIÓN SOCIAL DEL DEPARTAMENTO DE BOYACÁ
120000001500003,INSTITUTO DE TRÁNSITO DE BOYACÁ -ITBOY-
120000001500004,HOSPITAL PSIQUIATRICO DE BOYACÁ
120000001500005,INDUSTRIA LICORERA DE BOYACÁ EN LIQUIDACIÓN
120000001500006,INSTITUTO DE CULTURA Y BELLAS ARTES DE BOYACÁ -ICBA-
120000001500007,INSTITUTO FINANCIERO DE DESARROLLO DE BOYACÁ -INFIBOY-
120000001500009,JUNTA ADMINISTRADORA DE DEPORTES DE BOYACÁ
120000001500010,SECRETARÍA DE SALUD DE BOYACÁ
120000001500011,INSTITUTO DE AGUA POTABLE Y ALCANTARILLADO DE BOYACÁ
120000001500012,E.S.E. CENTRO DE REHABILITACIÓN INTEGRAL DE BOYACÁ
120000001500013,E.S.E. HOSPITAL SAN RAFAEL DE TUNJA
120000001500014,E.S.E. HOSPITAL REGIONAL DE MONIQUIRÁ
120000001500015,E.S.E. HOSPITAL REGIONAL DE GUATEQUE
120000001500016,E.S.E. HOSPITAL REGIONAL DE GARAGOA
120000001500017,HOSPITAL SAN ANTONIO - SOATA
120000001500018,HOSPITAL REGIONAL DE DUITAMA
120000001500019,E.S.E. SALUD AQUITANIA
120000001500020,E.S.E. HOSPITAL SAN JOSE EL COCUY
120000001500021,E.S.E.HOSPITAL SAN VICENTE DE PAUL - PAIPA
120000001500022,FONDO MIXTO DE CULTURA DE BOYACÁ
120000001500023,FONDO REGIONAL DE GARANTÍAS DEL ORIENTE S.A.
120000001500024,FUNDACIÓN CASA DEL MENOR MARCO FIDEL SUAREZ
120000001500025,E.S.E. HOSPITAL REGIONAL DE CHIQUINQUIRÁ
120000001500026,E.S.E. HOSPITAL ESPECIAL DE CUBARÁ - CUBARÁ
120000001500027,HOSPITAL BAUDILIO ACERO
120000001500028,E.S.E. HOSPITAL JOSE CAYETANO VASQUEZ - PUERTO BOYACA
120000001500029,HOSPITAL SAN FRANCISCO - SAN LUIS DE GACENO
120000001500101,CAJA DE PREVISIÓN SOCIAL MUNICIPAL DE TUNJA
120000001500102,DEPARTAMENTO OBRAS PÚBLICAS Y VALORIZACIÓN MUNICIPAL DE TUNJA
120000001500103,EMPRESA DE ACUEDUCTO Y ALCANTARILLADO DE TUNJA LTDA
120000001500104,COMPAÑÍA DE SERVICIOS VARIOS DE TUNJA -COMSERVAR-
120000001500105,EMPRESA MATADERO DE TUNJA
120000001500106,INSTITUTO PARA LA RECREACION Y EL DEPORTE DE TUNJA - IRDET-
120000001500107,INSTITUTO DE VIVIENDA DE INTERÉS SOCIAL Y REFORMA URBANA DE TUNJA -INVITU-
120000001505101,UNIDAD ADMINISTRATIVA ESPECIAL CENTRO DE SALUD - ARCABUCO
120000001508701,E.S.E. CENTRO DE SALUD NUESTRA SEÑORA DE BELEN
120000001509001,E.S.E. CENTRO DE SALUD JUAN FRANCISCO BERBEO
120000001510401,E.S.E. SAN JOSÉ BOYACÁ
120000001510601,E.S.E. CENTRO DE SALUD DE BRICEÑO
120000001510901,E.S.E. CENTRO DE SALUD BUENAVISTA
120000001511401,E.S.E. BUSBANZA
120000001513501,E.S.E. CENTRO DE SALUD CAMPOHERMOSO
120000001516201,E.S.E. CENTRO DE SALUD - CERINZA
120000001517601,FONDO DE VIVIENDA DE INTERES SOCIAL Y REFORMA URBANA -FONVICHIQ-
120000001517602,CORPORACIÓN DE DESARROLLO DE CHIQUINQUIRÁ
120000001517603,TERMINAL DE TRANSPORTE DE CHIQUINQUIRÁ
120000001517604,E.S.P. ECOCHIQUINQUIRÁ 2020 S.A
120000001517605,E.S.P. EMPRESA INDUSTRIAL Y COMERCIAL DE SERVICIOS PÚBLICOS DE CHIQUINQUIRÁ -EMPOCHIQUINQUIRÁ-
120000001517606,INSTITUTO DE LA JUVENTUD EL DEPORTE Y LA RECREACIÓN DE CHIQUINQUIRA
120000001518501,E.S.E. CENTRO DE SALUD CHITARAQUE
120000001518701,E.S.E. CENTRO DE SALUD CHIVATA
120000001520401,E.S.E. CENTRO DE SALUD DE CÓMBITA
120000001521201,E.S.E. CENTRO DE SALUD LUIS LANCHEROS
120000001521501,E.S.E. PUESTO DE SALUD DE CORRALES
120000001522401,E.S.E. CENTRO DE SALUD SANTA LUCIA DE CUCAITA
120000001522601,E.S.E. CENTRO DE SALUD LAGOSALUD DE CUITIVA
120000001523201,E.S.E. CENTRO DE SALUD SAN PEDRO DE IGUAQUE
120000001523802,FONDO ROTATORIO DE VALORIZACIÓN DE DUITAMA
120000001523804,EMPRESA DE OBRAS SANITARIAS DE DUITAMA LTDA -EMPODUITAMA-
120000001523805,EMPRESA DE SERVICIOS PÚBLICOS DE DUITAMA -ESDU- EN LIQUIDACIÓN
120000001523806,FONDO DE VIVIENDA OBRERA DE DUITAMA -FONVIDU-
120000001523808,FONDO ROTATORIO DE PRÉSTAMOS PARA ESTUDIOS SUPERIORES DE DUITAMA -FONPRES- EN LIQUIDACIÓN
120000001523810,INSTITUTO DE CULTURA Y TURÍSMO DE DUITAMA -CULTURAMA-
120000001523812,INSTITUTO PARA LA EDUCACIÓN FÍSICA LA RECREACIÓN Y EL DEPORTE DE DUITAMA
120000001523814,FONDO DE VIGILANCIA Y SEGURIDAD CIUDADANA DE DUITAMA -FOVISDU-
120000001523816,E.S.E. SALUD DEL TUNDAMA
120000001527201,E.S.E. CENTRO DE SALUD FIRAVITOBA
120000001527601,E.S.E. CENTRO DE SALUD FLORESTA
120000001529301,E.S.E. CENTRO DE SALUD SAN ANTONIO DE PADUA - GACHANTIVÁ
120000001529601,E.S.E. GÁMEZA MUNICIPIO SALUDABLE
120000001529901,E.S.P. EMPRESAS PÚBLICAS MUNICIPALES DE GARAGOA S. A.
120000001538001,E.S.E. CENTRO DE SALUD LA CANDELARIA - LA CAPILLA
120000001538002,JUNTA MUNICIPAL DE DEPORTE RECREACIÓN Y APROVECHAMIENTO DEL TIEMPO LIBRE - LA CAPILLA
120000001540101,E.S.E. NUESTRA SEÑORA DE LAS VICTORIAS
120000001540701,SORTEO EXTRAORDINARIO DE VILLA DE LEIVA
120000001540702,E.S.P. EMPRESA MUNICIPAL DE SERVICIOS PÚBLICOS DE VILLA DE LEIVA
120000001546601,E.S.E. HOSPITAL LAS MERCEDES DE MONGÜÍ
120000001546901,INSTITUTO PARA LA CULTURA Y TURISMO DE MONIQUIRÁ
120000001546902,JUNTA ADMINISTRADORA DE DEPORTES DE MONIQUIRÁ
120000001547601,E.S.E. CENTRO DE SALUD - MOTAVITA
120000001549401,E.S.E. CENTRO DE SALUD NUEVO COLÓN
120000001550001,E.S.E. OICATÁ
120000001551401,E.S.E. CENTRO DE SALUD JORGE GONZÁLEZ OLMOS
120000001551602,INSTITUTO DE TURÍSMO Y RECREACIÓN DE PAIPA
120000001551604,INSTITUTO DE VIVIENDA DE INTERÉS SOCIAL Y REFORMA URBANA DE PAIPA
120000001551605,INSTITUTO MUNICIPAL PARA LA EDUCACIÓN FÍSICA LA RECREACIÓN Y EL DEPORTE DE PAIPA
120000001557201,E.S.P. EMPRESAS PÚBLICAS DE PUERTO BOYACÁ
120000001557202,INSTITUTO MUNICIPAL DE DEPORTES Y RECREACIÓN - PUERTO BOYACÁ
120000001558001,E.S.E. CENTRO DE SALUD NUESTRA SEÑORA DE LA PAZ - QUÍPAMA
120000001563801,E.S.P. DOMICILIARIOS - SÁCHICA
120000001575301,E.S.P. DOMICILIARIOS - SOATA EMPOSOATA
120000001575902,TERMINAL DE TRANSPORTE DE SOGAMOSO LTDA
120000001575904,E.S.P. COMPAÑÍA DE SERVICIOS PÚBLICOS DE SOGAMOSO S. A.
120000001575906,INSTITUTO PARA EL FOMENTO DE LA RECREACIÓN Y EL DEPORTE DE SOGAMOSO
120000001575908,FONDO DE VIVIENDA DE INTERÉS SOCIAL Y REFORMA URBANA DE SOGAMOSO -FONVISOG-
120000001575910,E.S.E. HOSPITAL REGIONAL DE SOGAMOSO
120000001575912,INSTITUTO DE TRÁNSITO Y TRANSPORTE DE SOGAMOSO
120000001576101,E.S.E. CENTRO DE SALUD SAN SEBASTIÁN - SOMONDOCO
120000001577601,E.S.E. CENTRO DE SALUD SANTO ECCEHOMO
120000001579801,E.S.E. HOSPITAL REGIONAL DEL VALLE DE TENZA
120000001580601,E.S.P. EMPRESAS MUNICIPALES DE TIBASOSA
120000001580602,FONDO DE VIVIENDA OBRERA DE TIBASOSA
120000001583501,JUNTA MUNICIPAL DE DEPORTE Y RECREACIÓN - TURMEQUE
120000001587901,E.S.E. CENTRO DE SALUD DE VIRACACHÁ
120000001700001,FONDO DE FOMENTO Y DESARROLLO DE CALDAS -FODECAL-
120000001700002,INDUSTRIA LICORERA DE CALDAS
120000001700003,E.S.E. HOSPITAL UNIVERSITARIO DE CALDAS
120000001700005,JUNTA ADMINISTRADORA DE DEPORTES DE CALDAS
120000001700007,HOSPITAL GENERAL SANTA SOFIA
120000001700009,EMPRESA DE OBRAS SANITARIAS DE CALDAS LTDA -EMPOCALDAS-
120000001700010,FONDO DE PRESTACIONES SOCIALES DEL DEPARTAMENTO DE CALDAS
120000001700011,INSTITUTO CALDENSE DE CULTURA
120000001700012,COOPERATIVA DE MUNICIPALIDADES DE CALDAS
120000001700013,CORPORACIÓN DEPARTAMENTAL DE TURÍSMO DE CALDAS -TURCALDAS-
120000001700015,INSTITUTO DEPARTAMENTAL DE TRÁNSITO Y TRANSPORTE DE CALDAS EN LIQUIDACIÓN
120000001700016,INSTITUTO FINANCIAMIENTO PROMOCIÓN Y DESARROLLO DE CALDAS -INFICALDAS-
120000001700017,UNIVERSIDAD DE CALDAS
120000001700018,INSTITUTO TECNOLÓGICO SUPERIOR DE CALDAS
120000001700020,FONDO MIXTO PROMOCIÓN DE LA CULTURA Y LAS ARTES DE CALDAS
120000001700021,E.S.E. HOSPITAL ASSBA SALUD
120000001700022,EMPRESA DEPARTAMENTAL PARA LA SALUD LTDA -EDSA-
120000001700023,EMPRESA DE RENOVACIÓN URBANA DE MANIZALES
120000001700024,DIRECCIÓN SECCIONAL DE SALUD DE CALDAS
120000001700025,TRIBUNAL DE ÉTICA MÉDICA DE CALDAS
120000001700026,TRIBUNAL SECCIONAL DE ÉTICA ODONTOLÓGICA DE CALDAS
120000001700027,E.S.E. HOSPITAL SAN VICENTE DE PAUL - ANSERMA
120000001700028,E.S.E. HOSPITAL SAN JOSE - BELALCAZAR
120000001700029,E.S.E. HOSPITAL SAN MARCOS - CHINCHINA
120000001700030,E.S.E. HOSPITAL SAN FELIX - LA DORADA
120000001700031,E.S.E. HOSPITAL LA MERCED - LA MERCED
120000001700032,E.S.E. HOSPITAL SAN ANTONIO - MANZANARES
120000001700033,E.S.E. HOSPITAL SANTA TERESITA - PACORA
120000001700034,E.S.E. HOSPITAL SANTA ANA - PALESTINA
120000001700035,E.P.S. ENTIDAD PROMOTORA DE SALUD DE CALDAS S.A.- CALDAS S.A.
120000001700101,EMPRESA MUNICIPAL PARA LA SALUD -EMSA-
120000001700102,CAJA DE VIVIENDA POPULAR DE MANIZALES
120000001700103,INSTITUTO DE VALORIZACIÓN MUNICIPAL DE MANIZALES
120000001700104,INSTITUTO FINANCIAMIENTO PROMOCIÓN Y DESARROLLO -INFI-
120000001700105,HOSPITAL GERIATRICO SAN ISIDRO
120000001700106,LOTERÍA DE MANIZALES
120000001700107,CENTRO DE DIAGNOSTICO AUTOMOTOR DE CALDAS LTDA
120000001700108,TERMINAL DE TRANSPORTE DE MANIZALES S. A.
120000001700110,EMPRESA METROPOLITANA DE ASEO
120000001700112,EMPRESA DE TELECOMUNICACIONES Y SERVICIOS AGREGADOS S. A. -EMTELSA-
120000001700114,E.S.P. AGUAS DE MANIZALES S. A.
120000001700116,FOMENTO Y TURÍSMO DE MANIZALES S. A.
120000001700117,EMPRESA DE RENOVACIÓN URBANA DE MANIZALES LTDA
120000001700118,EXPOFERIAS DE MANIZALES
120000001700119,ASOCIACIÓN DE SERVICIOS BASICOS EN SALUD -ASBASALUD-
120000001701301,E.S.E. HOSPITAL SAN JOSÉ - AGUADAS
120000001705001,E.S.P. AGUAS DE ARANZAZU
120000001727201,E.S.E. HOSPITAL SAN BERNARDO - FILADELFIA
120000001738801,E.S.P. AGUAS DE LA MERCED
120000001744201,ESCUELA DE MINAS DE MARMATO
120000001751301,AGUAS MANANTIALES DE PACORA E.S.P
120000001754101,HOSPITAL SAN JUAN DE DIOS DE PENSILVANIA
120000001754102,EMPRESAS PÚBLICAS DE PENSILVANIA
120000001761402,EMPRESAS PÚBLICAS DE RIOSUCIO
120000001761403,E.S.E. HOSPITAL SAN JUAN DE DIOS - RIOSUCIO
120000001761404,EMPRESA MUNICIPAL DE SERVICIOS DE ASEO -EMSA- RIOSUCIO
120000001765301,E.S.E. HOSPITAL FELIPE SUAREZ DE SALAMINA
120000001777701,E.S.E. HOSPITAL SAN LORENZO - SUPÍA
120000001786701,E.S.P. EMPRESA MUNICIPAL DE ASEO DE VICTORIA - EMAV
120000001787301,E.S.P. EMPRESAS PÚBLICAS DE VILLAMARIA- CALDAS AQUAMANA
120000001787701,E.S.E. HOSPITAL SAN JOSÉ - VITERBO
120000001800001,CAJA DE PREVISIÓN SOCIAL DEPARTAMENTAL DEL CAQUETÁ
120000001800002,EMPRESA DE TELEFONOS DEL CAQUETÁ
120000001800003,EMPRESA DE LICORES DEL CAQUETÁ
120000001800004,INSTITUTO DEPARTAMENTAL DE CULTURA Y TURÍSMO DEL CAQUETÁ
120000001800005,INSTITUTO DE TRÁNSITO Y TRANSPORTE DEL CAQUETÁ
120000001800006,LOTERÍA DEL CAQUETÁ
120000001800008,JUNTA ADMINISTRADORA DE DEPORTES DEL CAQUETÁ
120000001800009,INSTITUTO DEPARTAMENTAL DE SALUD DE CAQUETÁ
120000001800010,INSTITUTO DE DESARROLLO DEL CAQUETA -IDECA-
120000001800011,HOSPITAL REGIONAL MARÍA INMACULADA - FLORENCIA
120000001800012,FONDO MIXTO DE PROMOCIÓN DE CULTURA DEL CAQUETA
120000001800013,INSTITUTO DEPARTAMENTAL PARA EL DEPORTE Y LA RECREACION - INDER CAQUETA
120000001800014,ASOCIACIÓN DE MUNICIPIOS DEL CAQUETA
120000001800015,CENTRO DE BIENESTAR DEL ANCIANO SAN VICENTE DE PAUL
120000001800102,CAJA DE PREVISIÓN SOCIAL MUNICIPAL DE FLORENCIA
120000001800103,EMPRESA DE SERVICIOS VARIOS S. A. -SERVAF- FLORENCIA
120000001800104,INSTITUTO DE VALORIZACIÓN MUNICIPAL DE FLORENCIA
120000001800105,EMPRESA MUNICIPAL VIVIENDA Y RENOVACIÓN URBANA DE FLORENCIA
120000001800106,INSTITUTO MUNICIPAL DE OBRAS CIVILES -IMOC- DE FLORENCIA
120000001800107,TERMINAL DE TRANSPORTE DE FLORENCIA S. A.
120000001800108,INSTITUTO MUNICIPAL PARA EL DEPORTE Y LA RECREACIÓN DE FLORENCIA -INDERFLO-
120000001800109,E.S.E. HOSPITAL COMUNAL LAS MALVINAS - FLORENCIA
120000001800110,CENTRO COMERCIAL MUNICIPAL LA PERDIZ - CECOMPE
120000001815001,EMPRESA DE SERVICIOS PÚBLICOS CARTAGENA DEL CHAIRA
120000001820501,E.S.P. EMPRESA DE SERVICIOS DE CURILLO -ESERCU- S.A.
120000001824701,INSTITUTO MUNICIPAL DE DEPORTES DE EL DONCELLO
120000001824702,CASA DE LA CULTURA JESÚS ANGEL GONZÁLEZ ARIAS JAGA
120000001825601,EMPRESA MUNICIPAL DE SERVICIOS PÚBLICOS - EL PAUJIL (CAQUETA)
120000001825602,INSTITUTO MUNICIPAL DE DEPORTES DE EL PAUJIL
120000001875301,EMPRESA DE VIVIENDA DE INTERES SOCIAL EMVISAN - SAN VICENTE DEL CAGUAN
120000001875302,INSTITUTO MUNICIPAL DE DEPORTES - SAN VICENTE DEL CAGUAN
120000001886001,E.S.P. EMPRESA DE SERVICIOS PUBLICOS DE VALPARAISO - EMSERPVAL. S.A.
120000001900001,CAJA DE PREVISIÓN SOCIAL DEPARTAMENTAL DEL CAUCA
120000001900002,CORPORACIÓN DE TURÍSMO DEL CAUCA -CAUCATUR-
120000001900003,FONDO ROTATORIO DE VALORIZACIÓN DEPARTAMENTAL DEL CAUCA
120000001900004,INDUSTRIA LICORERA DEL CAUCA
120000001900005,DEPARTAMENTO ADMINISTRATIVO DE TRÁNSITO DEL CAUCA
120000001900006,LOTERÍA DEL CAUCA
120000001900007,TALLERES EDITORIALES DEL DEPARTAMENTO DEL CAUCA
120000001900009,JUNTA ADMINISTRADORA DE DEPORTES DEL CAUCA
120000001900010,DIRECCIÓN DEPARTAMENTAL DE SALUD DEL CAUCA
120000001900011,INSTITUTO FINANCIERO PARA EL DESARRROLLO -IFIDEC-
120000001900012,UNIDAD DEPARTAMENTAL DE AGUA S. A. -UNIAGUA- CAUCA
120000001900017,FONDO ROTATORIO SECRETARÍA DE OBRAS PÚBLICAS DEL CAUCA
120000001900018,FONDO MIXTO DE LA CULTURA Y LAS ARTES - CAUCA
120000001900019,E.S.P. EMPRESA DE ACUEDUCTO Y ALCANTARILLADO DEL RÍO PALO E.A.R.P.A. S.A.
120000001900101,CAJA DE PREVISIÓN SOCIAL MUNICIPAL DE POPAYÁN
120000001900102,E.S.P. EMPRESA MUNICIPAL DE TELECOMUNICACIONES DE POPAYÁN S. A.
120000001900103,ACUEDUCTO Y ALCANTARILLADO DE POPAYÁN S. A.
120000001900104,TERMINAL DE TRANSPORTES DE POPAYÁN S. A.
120000001900105,OFICINA DE VALORIZACIÓN MUNICIPAL DE POPAYÁN
120000001900106,E.S.E. HOSPITAL UNIVERSITARIO SAN JOSÉ
120000001900107,E.S.E. HOSPITAL REGIONAL SUSANA LOPEZ DE VALENCIA
120000001900108,HOSPITAL REG. FCO DE PAULA STDER STDER QUILICHAO
120000001900109,EMPRESA DE DESARROLLO URBANO DE POPAYÁN
120000001900110,INSTITUTO MUNICIPAL DEL DEPORTE Y RECREACIÓN DE POPAYÁN
120000001900111,CENTRO DE DIAGNÓSTICO AUTOMOTOR DE POPAYÁN LTDA
120000001900112,FONDO DE VIVIENDA DE POPAYÁN
120000001910001,INSTITUTO MUNICIPAL DE DEPORTE Y RECREACIÓN - BOLIVAR
120000001914201,E.S.P. DE CALOTO - EMPOCALOTO
120000001921202,EMPRESA DE ACUEDUCTO Y ALCANTARILLADO DE CORINTO -EMCORINTO-
120000001925601,E.S.E. HOSPITAL SANTA MARÍA - EL TAMBO
120000001941801,E.S.P. EMPRESA DE ENERGIA ELECTRICA DE LOPEZ DE LOPEZ DE MICAY
120000001945502,EMPRESAS PÚBLICAS MUNICIPALES DE MIRANDA
120000001953201,E.S.E. HOSPITAL NIVEL I EL BORDO
120000001953202,INSTITUTO MUNICIPAL DE ACUEDUCTO Y ALCANTARILLADO Y ASEO DE PATIA - EMPATIA -
120000001953203,EMPRESA MUNICIPAL GALERIA EL BORDO EN LIQUIDACION
120000001954801,EMPRESAS MUNICIPALES DE PIENDAMO
120000001954802,INSTITUTO MUNICIPAL PARA EL DEPORTE Y LA RECREACIÓN INDER - PIENDAMÓ
120000001957302,EMPRESAS PÚBLICAS MUNICIPALES DE PUERTO TEJADA
120000001962201,E.S.P. SERVICIOS PÚBLICOS DE ROSAS
120000001969801,EMPRESA DE ACUEDUCTO Y ALCANTARILLADO DE SANTADER DE QUILICHAO -EMQUILICHAO-
120000001969802,EMPRESAS PÚBLICAS MUNICIPALES DE SANTANDER DE QUILICHAO
120000001969803,INSTITUTO MUNICIPAL PARA EL DEPORTE DE SANTANDER DE QUILICHAO
120000001969804,E.S.E. QUILISALUD
120000001976001,JUNTA MUNICIPAL DE DEPORTES DE SOTARÁ
120000001978001,E.S.P.DE SUAREZ -EMSUAREZ-
120000001980701,E.S.E. CENTRO DE SALUD DE TIMBÍO
120000001980702,E.S.P. EMPRESA MUNICIPAL DE SERVICIOS PÚBLICOS DE TIMBÍO -EMTIMBÍO-
120000001982101,E.S.E. CXAYU CE JXUT
120000001984501,E.S.P. EMPRESA DE SERVICIOS PÚBLICOS - EMVILLARICA
120000002000001,CASA DEL ABUELO
120000002000002,LOTERÍA DEL CESAR -LA VALLENATA-
120000002000004,JUNTA ADMINISTRADORA DE DEPORTES DEL CESAR
120000002000005,DEPARTAMENTO ADMINISTRATIVO DE SALUD DEL CESAR -DASALUC-
120000002000006,INSTITUTO DEPARTAMENTAL REHABILITACIÓN Y EDUCACIÓN ESPECIAL - VALLEDUPAR
120000002000007,INSTITUTO DE CULTURA Y TURÍSMO DEL CESAR
120000002000008,INSTITUTO DEPARTAMENTAL DE TRÁNSITO DEL CESAR
120000002000009,FONDO ROTATORIO DE VALORIZACIÓN DEPARTAMENTAL DEL CESAR
120000002000010,HOSPITAL ROSARIO PUMAREJO DE LOPEZ
120000002000012,INSTITUTO DE CAPACITACIÓN PARA ADULTOS ROSITA DAVILA DE CUELLO
120000002000013,E.S.E. HOSPITAL REGIONAL DE AGUACHICA
120000002000014,E.S.E. HOSPITAL AGUSTÍN CODAZZI
120000002000015,E.S.E. HOSPITAL SAN ROQUE DE EL COPEY
120000002000016,HOSPITAL OLAYA HERRERA - GAMARRA
120000002000017,FONDO MIXTO PARA LA PROMOCION DE LA CULTURA Y LAS ARTES DEL CESAR
120000002000101,EMPRESA DE SERVICIOS VARIOS DE VALLEDUPAR -EMDUPAR-
120000002000102,FONDO MUNICIPAL DE VALORIZACIÓN DE VALLEDUPAR
120000002000103,INSTITUTO HOGAR DEL NINO DE VALLEDUPAR
120000002000104,TERMINAL DE TRANSPORTE DE VALLEDUPAR S. A.
120000002000105,FONDO DE VIVIENDA DE INTERÉS SOCIAL Y REFORMA URBANA - VALLEDUPAR
120000002000106,FONDO MUNICIPAL DEL DEPORTE DE VALLEDUPAR
120000002000107,E.S.E. HOSPITAL EDUARDO ARREDONDO DAZA
120000002000108,INSTITUTO MUNICIPAL DE TRÁNSITO Y TRANSPORTE - VALLEDUPAR
120000002001102,INSTITUTO MUNICIPAL DE TRANSITO Y TRANSPORTE DE AGUACHICA
120000002001103,E.S.E. HOSPITAL LOCAL DE AGUACHICA
120000002300001,CAJA DEPARTAMENTAL DE PREVISIÓN SOCIAL DE CÓRDOBA
120000002300002,LOTERÍA DE CÓRDOBA
120000002300004,JUNTA ADMINISTRADORA DE DEPORTES DE CÓRDOBA
120000002300005,DEPARTAMENTO ADMINISTRATIVO DE SALUD DE CÓRDOBA
120000002300006,EMPRESA DE OBRAS SANITARIAS DE CÓRDOBA
120000002300007,INSTITUTO FINANCIERO PARA EL DESARROLLO DE CÓRDOBA
120000002300008,HOSPITAL REGIONAL SAN JERONIMO - MONTERÍA
120000002300009,HOSPITAL DEPARTAMENTAL SAN VICENTE DE PAUL - LORICA
120000002300010,INSTITUTO DEPARTAMENTAL DE TRÁNSITO Y TRANSPORTE DE CÓRDOBA
120000002300011,FONDO MIXTO PARA LA PROMOCION DE LA CULTURA DE CORDOBA
120000002300012,HOSPITAL SAN JOSE - TIERRALTA
120000002300013,HOSPITAL SAGRADO CORAZÓN DE JESUS - VALENCIA
120000002300014,E.S.E. HOSPITAL SAN FRANCISCO - CIÉNAGA DE ORO
120000002300015,HOSPITAL SAN NICOLAS - PLANETA RICA
120000002300016,E.S.E. HOSPITAL LOCAL - MONTELIBANO
120000002300017,HOSPITAL SAN JORGE - AYAPEL
120000002300018,E.S.E. SAN JOSE - SAN BERNARDO DEL VIENTO
120000002300019,HOSPITAL SAN RAFAEL - CHINU
120000002300020,HOSPITAL SAN DIEGO - CERETE
120000002300021,E.S.E HOSPITAL SAN JUAN
120000002300101,EMPRESAS PÚBLICAS MUNICIPALES DE MONTERÍA
120000002300102,OFICINA DE VALORIZACIÓN MUNICIPAL DE MONTERÍA
120000002300103,CAJA DE PREVISIÓN SOCIAL MUNICIPAL DE MONTERÍA
120000002300104,SOCIEDAD DE ACUEDUCTO Y ALCANTARILLADO DE MONTERÍA
120000002300105,E.S.E CAMU EL AMPARO
120000002306802,EMPRESAS PÚBLICAS MUNICIPALES DE AYAPEL
120000002316202,EMPRESA REGIONAL AGUAS DEL SINU S. A. -ERAS- CERETE
120000002318202,CAJA DE PREVISIÓN SOCIAL MUNICIPAL DE CHINÚ
120000002318902,FONDO MUNICIPAL PRESTACIONES SOCIALES CIENAGA DE ORO
120000002318904,EMPRESA DE SERVICIOS PÚBLICOS MUNICIPALES DE CIENAGA DE ORO
120000002346402,EMPRESAS PÚBLICAS DE SERVICIOS SANITARIOS - MOMIL
120000002355502,EMPRESAS PÚBLICAS MUNICIPALES DE PLANETA RICA EN LIQUIDACIÓN
120000002357002,JUNTA ADMINIST. DE SERVICIOS PÚBLICOS DE PUEBLO NUEVO
120000002357003,EMPRESA DE ACUEDUCTO Y ALCANTARILLADO DE PUEBLO NUEVO
120000002366002,EMPRESAS VARIAS MUNICIPALES DE SAHAGUN
120000002367202,JUNTA DE ACUEDUCTO DE SAN ANTERO
120000002367502,EMPRESA DE ACUEDUCTO Y ALCANTARILLADO DE SAN BERNARDO
120000002367802,JUNTA ADMINISTRAD.DE SERVICIOS PÚBLICOS - SAN CARLOS
120000002368602,JUNTA ADMDORA DE SERVICIOS PÚBLICOS DE SAN PELAYO
120000002500001,BENEFICENCIA DE CUNDINAMARCA
120000002500002,ENTIDAD PROMOTORA DE SALUD -CONVIDA- E.P.S. EN LIQUIDACIÓN
120000002500003,CORPORACIÓN DE CULTURA Y TURÍSMO DE CUNDINAMARCA
120000002500004,CORPORACIÓN SOCIAL DE CUNDINAMARCA
120000002500005,INSTITUTO DE AGUAS Y SANEAMIENTO DE CUNDINAMARCA
120000002500006,INSTITUTO DEPARTAMENTAL DE VALORIZACIÓN DE CUNDINAMARCA
120000002500007,EMPRESA DE LICORES DE CUNDINAMARCA
120000002500008,LOTERÍA DE CUNDINAMARCA
120000002500010,INSTITUTO DEPARTAMENTAL PARA LA RECREACIÓN Y EL DEPORTE DE CUNDINAMARCA -CUNDEPORTES-
120000002500012,INSTITUTO FARMACEUTICO DE CUNDINAMARCA
120000002500013,UNIVERSIDAD DE CUNDINAMARCA
120000002500014,CORPORACIÓN FINANCIERA DE CUNDINAMARCA S. A. EN LIQUIDACIÓN
120000002500018,INSTITUTO DEPARTAMENTAL TRÁNSITO Y TRANSPORTES CUNDINAMARCA
120000002500019,EMPRESA EDITORIAL DE CUNDINAMARCA ANTONIO NARIÑO -EDICUNDI- EN LIQUIDACIÓN
120000002500020,EMPRESA INMOBILIARIA DE CUNDINAMARCA
120000002500021,E.I.C.E. ENTIDAD ADMINISTRADORA DEL REGIMEN SUBSIDIADO A.R.S. CONVIDA
120000002500022,E.S.E. HOSPITAL MARCO FELIPE AFANADOR DE TOCAIMA - TOCAIMA
120000002500023,E.S.E. HOSPITAL UNIVERSITARIO LA SAMARITANA
120000002500024,E.S.E. HOSPITAL SAN RAFAEL - CAQUEZA
120000002500025,E.S.E. HOSPITAL SAN MARTIN DE PORRES - CHOCONTA
120000002500026,E.S.E. HOSPITAL SAN RAFAEL - FACATATIVÁ
120000002500027,E.S.E. HOSPITAL SAN RAFAEL - FUSAGASUGA
